{
  "$schema": "http://json-schema.org/draft-07/schema#",
  "$id": "access_decision",
  "title": "Access control decision",
  "description": "Topic garage/access/decision. Published by the edge access-control service for every ALPR event and manual action.",
  "type": "object",
  "required": ["decisionId", "direction", "decision", "reason", "manual", "timestamp"],
  "properties": {
    "decisionId": {"type": "string"},
    "direction": {"enum": ["ENTRY", "EXIT"]},
    "plate": {"type": ["string", "null"]},
    "confidence": {"type": ["number", "null"], "minimum": 0, "maximum": 1},
    "decision": {"enum": ["GRANTED", "DENIED", "RETRY", "MANUAL_REQUIRED"]},
    "reason": {"enum": ["AUTHORIZED", "NOT_ON_ALLOWLIST", "GARAGE_FULL", "LOW_CONFIDENCE", "INVALID_FORMAT", "NO_PLATE", "CAMERA_ERROR", "ALREADY_INSIDE", "NO_ACTIVE_SESSION", "MANUAL_APPROVAL", "MANUAL_DENIAL", "GATE_BUSY"]},
    "gateRequestId": {"type": ["string", "null"]},
    "sessionId": {"type": ["string", "null"]},
    "freeSpots": {"type": ["integer", "null"], "minimum": 0},
    "manual": {"type": "boolean"},
    "operator": {"type": ["string", "null"]},
    "timestamp": {"type": "string", "pattern": "^\\d{4}-\\d{2}-\\d{2}T\\d{2}:\\d{2}:\\d{2}(\\.\\d{1,6})?Z$"}
  }
}
